source,title,organizer,deadline,category,description,url,score,matched_keywords,review_reason
csv,2026 공공데이터 활용 분석 공모전,한국데이터진흥원,2026-07-19,데이터분석,공공데이터를 활용한 분석 보고서와 시각화 결과물을 모집합니다.,https://example.org/contest/public-data,6,"데이터, 시각화, 공공",우선 검토
sample-site,공공서비스 자동화 아이디어 챌린지,공공서비스혁신단,2026-08-20,서비스기획,"민원, 복지, 교육 데이터를 활용한 자동화 아이디어와 간단한 프로토타입을 제안합니다.",https://example.org/site/public-service,6,"데이터, 프로토타입, 공공",우선 검토
csv,도시 데이터 시각화 경진대회,스마트시티협회,2026-08-01,데이터시각화,교통과 생활 데이터를 분석해 대시보드 형태로 제안합니다.,https://example.org/contest/city-viz,5,"데이터, 시각화",우선 검토
csv,AI 서비스 프로토타입 챌린지,디지털혁신재단,2026-08-12,서비스기획,AI를 활용한 서비스 기획안과 작동 가능한 프로토타입을 모집합니다.,https://example.org/contest/ai-prototype,4,"AI, 프로토타입",우선 검토
sample-site,생활 데이터 분석 리포트 공모전,생활데이터랩,2026-07-25,데이터분석,"소상공인, 이동, 날씨 데이터를 엮어 생활 문제를 분석하는 리포트 공모전입니다.",https://example.org/site/life-data,3,데이터,우선 검토
